{
  "$schema": "../../../STANDARD/schemas/character_state_transitions.schema.json",
  "schema_family": "character-state-transitions",
  "schema_version": "1.0.0",
  "project_id": "PRJ-005",
  "narrative_path": "SURVIVOR_RECOVERY",
  "transitions": [
    {
      "transition_id": "CSTATE-001",
      "order": 1,
      "character_id": "CHAR-01",
      "scope_type": "BEAT",
      "scope_id": "BEAT-01",
      "state_before": "점검 절차가 결국 자신을 보호할 것이라 믿는다.",
      "state_after": "닫힌 문과 반복되는 종소리가 의도적인 이동 제한일 수 있음을 인식한다.",
      "triggers": {
        "fact_ids": [
          "FACT-03"
        ],
        "clue_ids": [
          "CLUE-01"
        ],
        "crime_event_ids": [
          "EVENT-01"
        ]
      },
      "change_category": "RISK"
    },
    {
      "transition_id": "CSTATE-002",
      "order": 2,
      "character_id": "CHAR-01",
      "scope_type": "BEAT",
      "scope_id": "BEAT-04",
      "state_before": "닫힌 문과 반복되는 종소리가 의도적인 이동 제한일 수 있음을 인식한다.",
      "state_after": "즉시 문을 두드리는 것과 별개로 봉인 사진과 자신의 기억을 지키기로 선택한다.",
      "triggers": {
        "fact_ids": [
          "FACT-01",
          "FACT-02"
        ],
        "clue_ids": [
          "CLUE-02"
        ],
        "crime_event_ids": [
          "EVENT-01"
        ]
      },
      "change_category": "CHOICE"
    },
    {
      "transition_id": "CSTATE-003",
      "order": 3,
      "character_id": "CHAR-02",
      "scope_type": "BEAT",
      "scope_id": "BEAT-03",
      "state_before": "확인 통화가 늦어진 것을 폐관 업무의 흔한 변수로 여긴다.",
      "state_after": "통화 중단과 첫 종소리의 일치가 해온의 위험 신호라고 의심한다.",
      "triggers": {
        "fact_ids": [
          "FACT-07"
        ],
        "clue_ids": [
          "CLUE-03"
        ],
        "crime_event_ids": []
      },
      "change_category": "BELIEF"
    },
    {
      "transition_id": "CSTATE-004",
      "order": 4,
      "character_id": "CHAR-02",
      "scope_type": "BEAT",
      "scope_id": "BEAT-05",
      "state_before": "통화 중단과 첫 종소리의 일치가 해온의 위험 신호라고 의심한다.",
      "state_after": "계약 연장에 불리하더라도 지시를 거슬러 종소리 방향을 따라 수장고를 찾는다.",
      "triggers": {
        "fact_ids": [
          "FACT-07"
        ],
        "clue_ids": [
          "CLUE-01",
          "CLUE-03"
        ],
        "crime_event_ids": [
          "EVENT-01"
        ]
      },
      "change_category": "CHOICE"
    },
    {
      "transition_id": "CSTATE-005",
      "order": 5,
      "character_id": "CHAR-01",
      "scope_type": "BEAT",
      "scope_id": "BEAT-07",
      "state_before": "즉시 문을 두드리는 것과 별개로 봉인 사진과 자신의 기억을 지키기로 선택한다.",
      "state_after": "기억의 빈칸이 있어도 공황 사고라는 타인의 결론을 받아들이지 않는다.",
      "triggers": {
        "fact_ids": [
          "FACT-09"
        ],
        "clue_ids": [
          "CLUE-05"
        ],
        "crime_event_ids": []
      },
      "change_category": "BELIEF"
    },
    {
      "transition_id": "CSTATE-006",
      "order": 6,
      "character_id": "CHAR-05",
      "scope_type": "BEAT",
      "scope_id": "BEAT-09",
      "state_before": "봉인 교체와 점검 기록을 서로 분리된 관리 실수로 검토한다.",
      "state_after": "Seed 장면부터 이어진 종과 두 기록의 모순이 두 출입 권한을 감추는 구조라고 본다.",
      "triggers": {
        "fact_ids": [
          "FACT-08"
        ],
        "clue_ids": [
          "CLUE-01",
          "CLUE-02",
          "CLUE-04"
        ],
        "crime_event_ids": []
      },
      "change_category": "INFORMATION"
    },
    {
      "transition_id": "CSTATE-007",
      "order": 7,
      "character_id": "CHAR-05",
      "scope_type": "BEAT",
      "scope_id": "BEAT-10",
      "state_before": "Seed 장면부터 이어진 종과 두 기록의 모순이 두 출입 권한을 감추는 구조라고 본다.",
      "state_after": "문재호와 백도윤의 공동 감금 및 은폐 책임을 확정한다.",
      "triggers": {
        "fact_ids": [
          "FACT-02",
          "FACT-05",
          "FACT-06"
        ],
        "clue_ids": [
          "CLUE-01",
          "CLUE-02",
          "CLUE-04"
        ],
        "crime_event_ids": [
          "EVENT-01"
        ]
      },
      "change_category": "BELIEF"
    },
    {
      "transition_id": "CSTATE-008",
      "order": 8,
      "character_id": "CHAR-01",
      "scope_type": "BEAT",
      "scope_id": "BEAT-11",
      "state_before": "기억의 빈칸이 있어도 공황 사고라는 타인의 결론을 받아들이지 않는다.",
      "state_after": "단편 기억과 피해 결과를 자신의 언어로 증언해 사건 결말의 결정권을 되찾는다.",
      "triggers": {
        "fact_ids": [
          "FACT-04",
          "FACT-06"
        ],
        "clue_ids": [
          "CLUE-01"
        ],
        "crime_event_ids": [
          "EVENT-01"
        ]
      },
      "change_category": "CHOICE",
      "recovery_function": "AGENCY_RECOVERY"
    }
  ]
}
